{
  "meta": {
    "schema_version": "1.0.0",
    "run_id": "b05-idw-syn40-seed42",
    "dataset_id": "05902f5167e6a8aefa02386b6437bfa984a2ec3b67e3fffee7c69d7b145c8351",
    "dataset_kind": "synthetic",
    "artifact_kind": "model_output",
    "generated_at_utc": "2026-10-24T16:43:49Z",
    "as_of_date": "2024-12-31",
    "default_method": "idw",
    "depth_unit": "m_below_ground",
    "caption": "IDW baseline on the synthetic dataset 05902f5167e6a8aefa02386b6437bfa984a2ec3b67e3fffee7c69d7b145c8351. Neural methods were not run. This is not field accuracy."
  },
  "code_revision": "37eedee9d5c7eccf6c86d6eccf09fd4623030281+dirty",
  "checkpoint_sha256": null,
  "python_version": "3.11.17",
  "torch_version": "2.8.0+cu128",
  "device": "cpu",
  "nodus_job_ids": [],
  "selected_positive_lambda": null,
  "physics_assumptions": [
    "Physics regulariser was not run. q was not estimated. This export is the IDW baseline only."
  ],
  "data_sources": [
    "synthetic bundle 05902f5167e6a8aefa02386b6437bfa984a2ec3b67e3fffee7c69d7b145c8351",
    "IDW uses previous-day visible depths only, power 2, at most 6 donors.",
    "Fictional wells. NASA POWER weather forced the synthetic generator and is not a well gauge."
  ]
}
