{
  "meta": {
    "schema_version": "1.0.0",
    "run_id": "fixture-layout-v1",
    "dataset_id": "synthetic-layout-six-wells",
    "dataset_kind": "synthetic",
    "artifact_kind": "fixture",
    "generated_at_utc": "2026-10-21T12:00:00Z",
    "as_of_date": "2024-09-29",
    "default_method": "idw",
    "depth_unit": "m_below_ground",
    "caption": "Illustrative synthetic UI fixture. No model has been trained and no accuracy is claimed."
  },
  "code_revision": null,
  "checkpoint_sha256": null,
  "python_version": null,
  "torch_version": null,
  "device": null,
  "nodus_job_ids": [],
  "selected_positive_lambda": null,
  "physics_assumptions": [
    "Not run; see MASTER_PLAN.md for proposed assumptions."
  ],
  "data_sources": [
    "Illustrative fixture generated for interface development; no groundwater source data."
  ]
}
